{
  "$schema": "http://json-schema.org/draft-07/schema#",
  "$id": "urn:javis-dog:jgr:conformance:otlp:vector:adr-0011",
  "title": "Local OTLP receiver conformance vector (ADR-0011)",
  "description": "One black-box case for the local OTLP/HTTP JSON metrics receiver of the javi collector (JD-C01), derived from ADR-0011, JGR spec v0.1, the OTLP specification and the Claude Code monitoring documentation. See README.md for runner semantics.",
  "type": "object",
  "additionalProperties": false,
  "required": [
    "description",
    "contract",
    "ambiguities",
    "steps",
    "forbiddenStrings",
    "identityGroup"
  ],
  "properties": {
    "$schema": { "type": "string" },
    "description": { "type": "string", "minLength": 1 },
    "contract": {
      "description": "Contract text the expectation is derived from (ADR-0011 section, OTLP spec section, spec section, Claude Code docs).",
      "type": "string",
      "minLength": 1
    },
    "ambiguities": {
      "description": "README ambiguity ids (A1, A2, ...) whose chosen interpretation this vector relies on.",
      "type": "array",
      "uniqueItems": true,
      "items": { "type": "string", "pattern": "^A[1-9][0-9]*$" }
    },
    "steps": {
      "description": "Requests sent in order to ONE receiver instance (no restart between steps).",
      "type": "array",
      "minItems": 1,
      "items": { "$ref": "#/definitions/step" }
    },
    "forbiddenStrings": {
      "description": "Strings that MUST NOT occur in any spooled or delivered byte (README: Forbidden strings), in addition to the global list.",
      "type": "array",
      "uniqueItems": true,
      "items": { "type": "string", "minLength": 1 }
    },
    "identityGroup": {
      "description": "Scope of idLabel comparison across vectors. null: labels are compared within this vector only.",
      "type": ["string", "null"]
    }
  },
  "definitions": {
    "step": {
      "type": "object",
      "additionalProperties": false,
      "required": ["request", "expect"],
      "properties": {
        "request": { "$ref": "#/definitions/request" },
        "expect": { "$ref": "#/definitions/expect" }
      }
    },
    "request": {
      "type": "object",
      "additionalProperties": false,
      "required": ["method", "path", "headers", "gzip", "body", "rawBody", "bodyPadBytes"],
      "properties": {
        "method": { "enum": ["GET", "POST", "PUT", "DELETE", "PATCH", "HEAD", "OPTIONS"] },
        "path": { "type": "string", "pattern": "^/" },
        "headers": {
          "description": "Request headers (lower-case names), sent exactly. $PORT, $SECRET and $WRONG_SECRET are substituted inside values. Content-Encoding: gzip is added when gzip is true and no content-encoding is listed.",
          "type": "object",
          "propertyNames": { "pattern": "^[a-z0-9-]+$" },
          "additionalProperties": { "type": "string" }
        },
        "gzip": { "type": "boolean" },
        "body": {
          "description": "JSON body (an OTLP ExportMetricsServiceRequest or a deliberately invalid value), serialized compactly by the runner.",
          "type": ["object", "array", "null"]
        },
        "rawBody": {
          "description": "Exact UTF-8 body string; used instead of body.",
          "type": ["string", "null"]
        },
        "bodyPadBytes": {
          "description": "Pad the serialized body with ASCII spaces (0x20) at the end until it is at least this many bytes, before gzip.",
          "type": ["integer", "null"],
          "minimum": 1
        }
      },
      "oneOf": [
        {
          "properties": { "body": { "not": { "type": "null" } }, "rawBody": { "type": "null" } }
        },
        { "properties": { "body": { "type": "null" }, "rawBody": { "type": "string" } } }
      ]
    },
    "matcher": {
      "description": "A string means exact equality. An object combines the listed checks.",
      "oneOf": [
        { "type": "string" },
        {
          "type": "object",
          "additionalProperties": false,
          "minProperties": 1,
          "properties": {
            "equals": {},
            "pattern": { "type": "string", "format": "regex" },
            "integerMin": { "type": "integer" },
            "integerMax": { "type": "integer" },
            "present": { "const": true },
            "absent": { "const": true }
          }
        }
      ]
    },
    "usageDelta": {
      "description": "Expected usage_delta (ADR-0011 Mapping). Every counter is listed; README: Event comparison says how an absent counter compares.",
      "type": "object",
      "additionalProperties": false,
      "required": [
        "input_tokens",
        "output_tokens",
        "cache_read_tokens",
        "cache_write_tokens",
        "cost_usd",
        "model",
        "estimated"
      ],
      "properties": {
        "input_tokens": { "type": "integer", "minimum": 0 },
        "output_tokens": { "type": "integer", "minimum": 0 },
        "cache_read_tokens": { "type": "integer", "minimum": 0 },
        "cache_write_tokens": { "type": "integer", "minimum": 0 },
        "cost_usd": { "type": "number", "minimum": 0 },
        "model": { "type": "string", "minLength": 1 },
        "estimated": { "const": false }
      }
    },
    "expectedEvent": {
      "type": "object",
      "additionalProperties": false,
      "required": ["idLabel", "session", "occurred_at", "usage_delta"],
      "properties": {
        "idLabel": {
          "description": "Same label within the scope (vector or identityGroup) means equal event_id; different labels mean different event_id.",
          "type": "string",
          "pattern": "^u[0-9]+$"
        },
        "session": {
          "description": "Raw OTel session.id; the event's thread_ref MUST equal opaqueRef('cc', session, salt).",
          "enum": ["sess-known"]
        },
        "occurred_at": {
          "description": "RFC 3339 instant the event's occurred_at MUST equal (the point's timeUnixNano).",
          "type": "string",
          "pattern": "^[0-9]{4}-[0-9]{2}-[0-9]{2}T[0-9]{2}:[0-9]{2}:[0-9]{2}Z$"
        },
        "usage_delta": { "$ref": "#/definitions/usageDelta" }
      }
    },
    "expect": {
      "type": "object",
      "additionalProperties": false,
      "required": ["status", "headers", "body", "events", "droppedUnattributed"],
      "properties": {
        "status": { "type": "integer", "minimum": 100, "maximum": 599 },
        "headers": {
          "description": "Response header matchers; names compared case-insensitively; unlisted headers are not checked.",
          "type": "object",
          "propertyNames": { "pattern": "^[a-z0-9-]+$" },
          "additionalProperties": { "$ref": "#/definitions/matcher" }
        },
        "body": {
          "description": "Exact JSON value of the parsed response body; null means not checked.",
          "type": ["object", "null"]
        },
        "events": {
          "description": "usage.reported events whose event_id first appears after this step (README: Event observation). Order-insensitive.",
          "type": "array",
          "items": { "$ref": "#/definitions/expectedEvent" }
        },
        "droppedUnattributed": {
          "description": "Matcher on the increase of the receiver's unattributed-drop counter caused by this step; null means not checked.",
          "oneOf": [{ "type": "null" }, { "$ref": "#/definitions/matcher" }]
        }
      },
      "allOf": [
        {
          "if": { "properties": { "status": { "const": 200 } } },
          "then": { "properties": { "body": { "const": {} } } },
          "else": {
            "properties": {
              "body": { "type": "null" },
              "events": { "maxItems": 0 }
            }
          }
        }
      ]
    }
  }
}
