{
  "$schema": "./schema.json",
  "description": "Token points in one scopeMetrics and the cost point in another, same (session, model, start, end): one event",
  "contract": "ADR-0011 Mapping (grouped by session.id, model, startTimeUnixNano, timeUnixNano into one event)",
  "ambiguities": [],
  "steps": [
    {
      "request": {
        "method": "POST",
        "path": "/v1/metrics",
        "headers": {
          "host": "127.0.0.1:$PORT",
          "content-type": "application/json",
          "authorization": "Bearer $SECRET"
        },
        "gzip": false,
        "body": {
          "resourceMetrics": [
            {
              "resource": {
                "attributes": [
                  {
                    "key": "service.name",
                    "value": {
                      "stringValue": "claude-code"
                    }
                  },
                  {
                    "key": "service.version",
                    "value": {
                      "stringValue": "2.1.0"
                    }
                  }
                ],
                "droppedAttributesCount": 0
              },
              "scopeMetrics": [
                {
                  "scope": {
                    "name": "com.anthropic.claude_code",
                    "version": "2.1.0"
                  },
                  "metrics": [
                    {
                      "name": "claude_code.token.usage",
                      "unit": "tokens",
                      "sum": {
                        "aggregationTemporality": 1,
                        "isMonotonic": true,
                        "dataPoints": [
                          {
                            "attributes": [
                              {
                                "key": "session.id",
                                "value": {
                                  "stringValue": "sess-known"
                                }
                              },
                              {
                                "key": "model",
                                "value": {
                                  "stringValue": "claude-opus-5-5"
                                }
                              },
                              {
                                "key": "type",
                                "value": {
                                  "stringValue": "input"
                                }
                              }
                            ],
                            "startTimeUnixNano": "1792497540000000000",
                            "timeUnixNano": "1792497600000000000",
                            "asInt": "1280"
                          },
                          {
                            "attributes": [
                              {
                                "key": "session.id",
                                "value": {
                                  "stringValue": "sess-known"
                                }
                              },
                              {
                                "key": "model",
                                "value": {
                                  "stringValue": "claude-opus-5-5"
                                }
                              },
                              {
                                "key": "type",
                                "value": {
                                  "stringValue": "output"
                                }
                              }
                            ],
                            "startTimeUnixNano": "1792497540000000000",
                            "timeUnixNano": "1792497600000000000",
                            "asInt": "462"
                          },
                          {
                            "attributes": [
                              {
                                "key": "session.id",
                                "value": {
                                  "stringValue": "sess-known"
                                }
                              },
                              {
                                "key": "model",
                                "value": {
                                  "stringValue": "claude-opus-5-5"
                                }
                              },
                              {
                                "key": "type",
                                "value": {
                                  "stringValue": "cacheRead"
                                }
                              }
                            ],
                            "startTimeUnixNano": "1792497540000000000",
                            "timeUnixNano": "1792497600000000000",
                            "asInt": "9000"
                          },
                          {
                            "attributes": [
                              {
                                "key": "session.id",
                                "value": {
                                  "stringValue": "sess-known"
                                }
                              },
                              {
                                "key": "model",
                                "value": {
                                  "stringValue": "claude-opus-5-5"
                                }
                              },
                              {
                                "key": "type",
                                "value": {
                                  "stringValue": "cacheCreation"
                                }
                              }
                            ],
                            "startTimeUnixNano": "1792497540000000000",
                            "timeUnixNano": "1792497600000000000",
                            "asInt": "512"
                          }
                        ]
                      }
                    }
                  ]
                },
                {
                  "scope": {
                    "name": "com.anthropic.claude_code.cost",
                    "version": "2.1.0"
                  },
                  "metrics": [
                    {
                      "name": "claude_code.cost.usage",
                      "unit": "USD",
                      "sum": {
                        "aggregationTemporality": 1,
                        "isMonotonic": true,
                        "dataPoints": [
                          {
                            "attributes": [
                              {
                                "key": "session.id",
                                "value": {
                                  "stringValue": "sess-known"
                                }
                              },
                              {
                                "key": "model",
                                "value": {
                                  "stringValue": "claude-opus-5-5"
                                }
                              }
                            ],
                            "startTimeUnixNano": "1792497540000000000",
                            "timeUnixNano": "1792497600000000000",
                            "asDouble": 0.0421
                          }
                        ]
                      }
                    }
                  ]
                }
              ]
            }
          ]
        },
        "rawBody": null,
        "bodyPadBytes": null
      },
      "expect": {
        "status": 200,
        "headers": {
          "content-type": {
            "pattern": "^application/json(\\s*;.*)?$"
          }
        },
        "body": {},
        "events": [
          {
            "idLabel": "u1",
            "session": "sess-known",
            "occurred_at": "2026-10-20T12:00:00Z",
            "usage_delta": {
              "input_tokens": 1280,
              "output_tokens": 462,
              "cache_read_tokens": 9000,
              "cache_write_tokens": 512,
              "cost_usd": 0.0421,
              "model": "claude-opus-5-5",
              "estimated": false
            }
          }
        ],
        "droppedUnattributed": null
      }
    }
  ],
  "forbiddenStrings": [],
  "identityGroup": null
}
