{
  "$schema": "./schema.json",
  "description": "Two delta exports of the same series in consecutive windows: each used as-is, two events with distinct identities",
  "contract": "ADR-0011 Temporality (delta used as-is); Mapping (group key includes the window); Claude Code (default temporality delta)",
  "ambiguities": [],
  "steps": [
    {
      "request": {
        "method": "POST",
        "path": "/v1/metrics",
        "headers": {
          "host": "127.0.0.1:$PORT",
          "content-type": "application/json",
          "authorization": "Bearer $SECRET"
        },
        "gzip": false,
        "body": {
          "resourceMetrics": [
            {
              "resource": {
                "attributes": [
                  {
                    "key": "service.name",
                    "value": {
                      "stringValue": "claude-code"
                    }
                  },
                  {
                    "key": "service.version",
                    "value": {
                      "stringValue": "2.1.0"
                    }
                  }
                ],
                "droppedAttributesCount": 0
              },
              "scopeMetrics": [
                {
                  "scope": {
                    "name": "com.anthropic.claude_code",
                    "version": "2.1.0"
                  },
                  "metrics": [
                    {
                      "name": "claude_code.token.usage",
                      "unit": "tokens",
                      "sum": {
                        "aggregationTemporality": 1,
                        "isMonotonic": true,
                        "dataPoints": [
                          {
                            "attributes": [
                              {
                                "key": "session.id",
                                "value": {
                                  "stringValue": "sess-known"
                                }
                              },
                              {
                                "key": "model",
                                "value": {
                                  "stringValue": "claude-opus-5-5"
                                }
                              },
                              {
                                "key": "type",
                                "value": {
                                  "stringValue": "input"
                                }
                              }
                            ],
                            "startTimeUnixNano": "1792497540000000000",
                            "timeUnixNano": "1792497600000000000",
                            "asInt": "100"
                          },
                          {
                            "attributes": [
                              {
                                "key": "session.id",
                                "value": {
                                  "stringValue": "sess-known"
                                }
                              },
                              {
                                "key": "model",
                                "value": {
                                  "stringValue": "claude-opus-5-5"
                                }
                              },
                              {
                                "key": "type",
                                "value": {
                                  "stringValue": "output"
                                }
                              }
                            ],
                            "startTimeUnixNano": "1792497540000000000",
                            "timeUnixNano": "1792497600000000000",
                            "asInt": "10"
                          }
                        ]
                      }
                    }
                  ]
                }
              ]
            }
          ]
        },
        "rawBody": null,
        "bodyPadBytes": null
      },
      "expect": {
        "status": 200,
        "headers": {
          "content-type": {
            "pattern": "^application/json(\\s*;.*)?$"
          }
        },
        "body": {},
        "events": [
          {
            "idLabel": "u1",
            "session": "sess-known",
            "occurred_at": "2026-10-20T12:00:00Z",
            "usage_delta": {
              "input_tokens": 100,
              "output_tokens": 10,
              "cache_read_tokens": 0,
              "cache_write_tokens": 0,
              "cost_usd": 0,
              "model": "claude-opus-5-5",
              "estimated": false
            }
          }
        ],
        "droppedUnattributed": null
      }
    },
    {
      "request": {
        "method": "POST",
        "path": "/v1/metrics",
        "headers": {
          "host": "127.0.0.1:$PORT",
          "content-type": "application/json",
          "authorization": "Bearer $SECRET"
        },
        "gzip": false,
        "body": {
          "resourceMetrics": [
            {
              "resource": {
                "attributes": [
                  {
                    "key": "service.name",
                    "value": {
                      "stringValue": "claude-code"
                    }
                  },
                  {
                    "key": "service.version",
                    "value": {
                      "stringValue": "2.1.0"
                    }
                  }
                ],
                "droppedAttributesCount": 0
              },
              "scopeMetrics": [
                {
                  "scope": {
                    "name": "com.anthropic.claude_code",
                    "version": "2.1.0"
                  },
                  "metrics": [
                    {
                      "name": "claude_code.token.usage",
                      "unit": "tokens",
                      "sum": {
                        "aggregationTemporality": 1,
                        "isMonotonic": true,
                        "dataPoints": [
                          {
                            "attributes": [
                              {
                                "key": "session.id",
                                "value": {
                                  "stringValue": "sess-known"
                                }
                              },
                              {
                                "key": "model",
                                "value": {
                                  "stringValue": "claude-opus-5-5"
                                }
                              },
                              {
                                "key": "type",
                                "value": {
                                  "stringValue": "input"
                                }
                              }
                            ],
                            "startTimeUnixNano": "1792497600000000000",
                            "timeUnixNano": "1792497660000000000",
                            "asInt": "100"
                          },
                          {
                            "attributes": [
                              {
                                "key": "session.id",
                                "value": {
                                  "stringValue": "sess-known"
                                }
                              },
                              {
                                "key": "model",
                                "value": {
                                  "stringValue": "claude-opus-5-5"
                                }
                              },
                              {
                                "key": "type",
                                "value": {
                                  "stringValue": "output"
                                }
                              }
                            ],
                            "startTimeUnixNano": "1792497600000000000",
                            "timeUnixNano": "1792497660000000000",
                            "asInt": "10"
                          }
                        ]
                      }
                    }
                  ]
                }
              ]
            }
          ]
        },
        "rawBody": null,
        "bodyPadBytes": null
      },
      "expect": {
        "status": 200,
        "headers": {
          "content-type": {
            "pattern": "^application/json(\\s*;.*)?$"
          }
        },
        "body": {},
        "events": [
          {
            "idLabel": "u2",
            "session": "sess-known",
            "occurred_at": "2026-10-20T12:01:00Z",
            "usage_delta": {
              "input_tokens": 100,
              "output_tokens": 10,
              "cache_read_tokens": 0,
              "cache_write_tokens": 0,
              "cost_usd": 0,
              "model": "claude-opus-5-5",
              "estimated": false
            }
          }
        ],
        "droppedUnattributed": null
      }
    }
  ],
  "forbiddenStrings": [],
  "identityGroup": null
}
